{
  "format": "alexandria-demo-plan/v1",
  "release": {"name": "credit-history-v0", "created_at": "2026-08-16T12:00:00Z"},
  "query": {
    "addresses": ["0x948d589df907c3f5cef1c62eeb051428fccbc709"],
    "entity": "Alexandria credit history fixture",
    "run_id": "alexandria-credit-history-v0"
  },
  "components": [
    {
      "name": "goldfinch-source", "path": "goldfinch.json",
      "repository_path": "plugins/tabularium/examples/goldfinch-v0/source.json",
      "source_sha256": "sha256:644b706804b6e28d69b1028b87937e0e36c882f703419d0e2bf568b056892bc9",
      "media_type": "application/json", "role": "raw-capture", "access": "public", "redistribution": "permitted"
    },
    {
      "name": "clearpool-source", "path": "clearpool.json",
      "repository_path": "plugins/alexandria/examples/credit-history-v0/sources/clearpool.json",
      "source_sha256": "sha256:946fbfbad93271b17d5343afad03847992290bf20635d58755b61aa3e56f7509",
      "media_type": "application/json", "role": "raw-capture", "access": "public", "redistribution": "permitted"
    }
  ],
  "captures": [
    {
      "id": "goldfinch-full", "component": "goldfinch-source", "venue": "goldfinch", "chain": "eip155:1", "evidence_class": "hosted-indexer",
      "source": {"kind": "hosted-indexer", "locator_class": "local-fixture", "reference": "plugins/tabularium/examples/goldfinch-v0/source.json"},
      "scope": {
        "kind": "full-dataset", "deployment": "goldfinch-v1", "finality": "provider-reported",
        "interval": {"kind": "snapshot", "observed_at": "2026-08-16T12:00:00Z"}
      },
      "coverage": {
        "status": "complete", "record_count": 567,
        "collections": [
          {"name": "borrows", "selector": "/borrows", "record_count": 34},
          {"name": "callable-loans", "selector": "/callableLoans", "record_count": 1},
          {"name": "credit-lines", "selector": "/creditLines", "record_count": 31},
          {"name": "repays", "selector": "/repays", "record_count": 477},
          {"name": "tranched-pools", "selector": "/tranchedPools", "record_count": 24}
        ],
        "unsupported_collections": [], "gaps": []
      }
    },
    {
      "id": "clearpool-subject", "component": "clearpool-source", "venue": "clearpool", "chain": "eip155:1", "evidence_class": "archive-log",
      "source": {"kind": "ethereum-logs", "locator_class": "local-fixture", "reference": "plugins/alexandria/examples/credit-history-v0/sources/clearpool.json"},
      "scope": {
        "kind": "subject-scoped", "deployment": "clearpool-mainnet", "finality": "unknown",
        "subjects": ["eip155:1:0x948d589df907c3f5cef1c62eeb051428fccbc709"],
        "interval": {"kind": "block-range", "start": "14443222", "end": "14791784"}
      },
      "coverage": {
        "status": "complete", "record_count": 12,
        "collections": [
          {"name": "factory-pools", "selector": "/factory_pools", "record_count": 1},
          {"name": "pool-logs", "selector": "/pool_logs/0xd70e551c7a90de0a25a4f3acbd126227e1a5d24d", "record_count": 11}
        ],
        "unsupported_collections": [], "gaps": []
      }
    }
  ]
}
